content_id,content_title_h1,content_title_description,content_class_main,content_class_sub,content_date_time,content_tag
,評論》為何柯文哲團隊能製造高聲量，卻無法轉化成支持度？,總統候選人民調，柯文哲出現停滯、乃至下滑之勢，即便未被侯友宜超越，但也正與賴清德拉開差距，出現了支持度的天花板。7月29日柯文哲募款演場會KP SHOW登場，儘管創造了高討論度和網路聲量，卻對跳脫負面,焦點,時事分析,2023/08/04,"柯文哲,民調,民眾黨,總統大選"
,裕隆城、造車都轉攻為守！嚴陳莉蓮「媽媽學」帶裕隆拚出金融、能源新支柱 - 商業周刊第1865期 - 商周線上讀,2018年底被迫臨危接棒的裕隆嚴陳莉蓮，對車的專業不如嚴凱泰，又逢電動車革命、疫情衝擊，但出人意料，嚴陳莉蓮在連番衝擊下卻靠「媽媽精神」開路！她從強攻改拚防守，捨棄造車主導權、向外找戰友減財務壓力；也打破強人領導，變百家爭鳴，讓金融、充電等生態鏈崛起成集團新支柱。,產業風雲, ,2023-08-10,"裕隆,嚴陳莉蓮,嚴凱泰,日產,汽車,領導,鴻海"
,大通膨時代還是想提早退休？你可以試試Barista FIRE,Barista FIRE結合了兼職工作的福利、與退休的自由，同時，也不用過得特別節儉。,財經,投資理財,2023/12/19,"財富自由,退休金,通膨,Barista FIRE,兼職,退休"
,劉德音退休！台積雙首長暫落幕 後續接班引關注,台積電董事長劉德音將於2024年股東大會後退休，推薦副董事長魏哲家接任下任董事長。市場相當關心，原本由劉德音處理的國內外政治相關事務，魏哲家會用怎樣的新風貌來協商溝通，後繼者的培養和選任，也將是相當重,財經,產業動態,2023/12/20," 劉德音,台積電, 魏哲家,半導體, 張忠謀"
,台積電邁入3.0！魏哲家一個人的路，有4大挑戰,台積電董事長劉德音將退休，推薦副董事長暨總裁魏哲家接任，業界認為，台積電將邁入「3.0世代」。魏哲家掌舵後，將面臨美日德等多廠區邁入量產後的實質管理問題、地緣政治風險延續壓力、晶圓製程將步入新材料世代,財經,產業動態,2023/12/20," 魏哲家, 半導體, 劉德音,台積電,張忠謀"
,囤房稅2.0三讀，房市將出現5大變化：對自住客和租屋族的影響？,囤房稅2.0三讀，手中有多屋的屋主可能開始出租手上的空屋以節稅，建商更傾向完銷預售屋，大坪數建案則可能更大幅讓利。租屋族可能承擔租金提高，或更大機率租到陳舊屋況的物件。,財經,地產風雲,2023/12/19,"建商,房價,房貸,自住,房租,囤房稅,囤房稅2.0,房東"
,日銀總裁植田未暗示將在1月解除負利率、日圓重貶,日銀總裁植田和男先前發言，增添市場最快12月解除負利率政策的預期。不過日銀19日宣布「維持現狀」，也未暗示將在2024年1月解除負利率，引發日圓重貶、一度逼近145關卡。,財經,投資理財,2023/12/20," 植田和男, 匯率, 日幣,日圓, 升息, 日銀"
,35歲在職場翻身的時代可能來了！「提供確定性」是最無法取代的能力,在過去十多年，網際網路產業高速成長，這個產業最基本的打法就是燒錢、燒人，員工像人肉電池一樣拚命工作，出現了許多靠青春吃飯的職業。在世界變化得更快的現在，我們更需要的是，能提供「不會變的能力」的人力。經,職場,職場修練,2023/12/18,"中年,確定性,能力,職場"
,只看標價買東西，竟讓你賺不了大錢？如何刻意練習「有錢思維」,1.翻完價格標籤後，就默默離開，無法了解品牌故事、設計理念、剪裁、材質等「價值」。2.當我們一直揹著貧窮的思維，路是走不遠的，也賺不了大錢。我們必須刻意練習，才能重建大腦對於金錢財富的神經連結。3.掏,職場,心靈成長,2021/05/06,"標價,價值,價格,有錢思維,貧窮印記"
https://podcasts.apple.com/tw/podcast/%E5%81%A5%E5%BA%B7%E5%95%8F%E8%89%AF%E9%86%AB/id1709234515,,,,,,
,寒流低溫警報！「這3天」最冷、哪些縣市10度以下？,氣象專家吳德榮表示，20日北台灣越晚越冷，21日至23日冷空氣最強，預估將符合寒流定義，局部低溫7度以下，高山有望降雪交通部中央氣象署20日發布低溫特報，20日晚間至21日，新竹以北及宜蘭，有持續10,焦點,時事分析,2023/12/20,"寒流幾度,氣象,寒流,天氣,溫度"
,慎防猝死！寒流一波接一波，醫師提醒這5類隱藏高危險群當心,1.典型的心血管疾病的高危險族群，包括了年長者、三高者、愛抽烟、愛喝酒、肥胖者，這是典型5大危險族群。2.看起來很健康的，也是有「5大非典型」高危險族群的。非典型（隱藏式）5大危險族群：暴飲暴食者、缺,生活,養生保健,2021/01/15,"寒流,感冒未癒,暴飲暴食,缺乏運動,猝死"
,寒流來襲！這3個時機要注意致命溫差,12月20日冷氣團南下，晚間氣溫逐漸下降，21日至23日冷空氣最強，應注意保暖。長輩、三高患者、心血管疾病患者、嬰幼兒，以及早出晚歸或輪值大夜班的民眾，要特別留意以衣物保暖。起床前、出門前、進門後，是,生活,養生保健,2023/12/20,"保暖,寒流,溫差,天氣"
,台積電「劉德音下、魏哲家上」，資本市場為何沒動靜？神山能再創高峰嗎？,台積電19日宣布董事長劉德音2024年將退休，由魏哲家接任下屆董事長。然而無論美股、台股，資本市場對此幾乎沒有反應。台積電雙首長制是怎麼運作的？它如何發揮「一加一大於二」的效益？一次看懂。台積電3.0,財經,產業動態,2023/12/20,"美中科技戰,台積電,張忠謀,劉德音,魏哲家,半導體"
,曾高居台積電研發六騎士　為何他不求升官、寧做後勤？ - 商業周刊第1884期 - 商周線上讀,商周線上讀，收錄台灣《商業周刊》雜誌歷年報導文章，包括第一桶金、金磚四國、一個台灣兩個世界、成功者的筆記本、台灣哥倫布、新零售、新製造、新物種等領先觀念，記錄台灣與世界二十年來的趨勢改變。,人物特寫, ,2023-12-21,
,70歲一頭黑髮、行李箱必放瑜伽墊　香氛代理王不老秘訣 - 商業周刊第1884期 - 商周線上讀,商周線上讀，收錄台灣《商業周刊》雜誌歷年報導文章，包括第一桶金、金磚四國、一個台灣兩個世界、成功者的筆記本、台灣哥倫布、新零售、新製造、新物種等領先觀念，記錄台灣與世界二十年來的趨勢改變。,封面故事, ,2023-12-21,
,退休前計算「每月3萬就綽綽有餘」，等到退休才發現：怎麼比上班更花錢,上班、工作忙有個好處，就是讓自己忙到沒時間花錢，平日只會花交通費和餐費，根本就不太有花錢的機會。退休人士對金錢的態度很可能是，怕錢還沒花完，人卻死了。因而，許多人會在退休後盡情享樂、盡情花錢。退休後天,財經,投資理財,2023/12/20,"職場,退休金,工作,退休"
,羽絨衣怎麼洗？可以用洗衣機或乾洗嗎？能不能烘乾？,在寒冷的冬天，台灣人最愛穿羽絨衣禦寒。但穿久了難免會髒，能不能把羽絨衣直接丟到洗衣機洗呢？本文整理羽絨衣正確清洗方式，並介紹羽絨衣烘乾、保持蓬鬆的正確觀念。,生活,,2023/12/19,"羽絨衣清洗,羽絨衣乾洗,羽絨衣手洗,羽絨衣怎麼洗,羽絨衣機洗,羽絨衣 洗衣機"
,2023冬至是哪一天？吃湯圓能開運嗎？意義、習俗、禁忌、由來⋯一次看,冬至是一年中，北半球黑夜最長、白晝最短的日子，因此又稱作「長至」、「短至」、「長至節」、「短至節」，台語念法為「冬節」。2023年冬至為12月22日，星期五。節氣常讓人誤以為是依循農曆而生，但其實是獨,焦點,時事分析,2023/12/19,"湯圓,節氣,習俗,補冬,冬至"
